<?xml version="1.0" encoding="UTF-8"?>
<!DOCTYPE qalab [<!ELEMENT qalab (summary,file*)>
<!ATTLIST qalab version CDATA #REQUIRED>
<!ELEMENT summary (summaryresult*)>
<!ELEMENT file (result+)>
<!ATTLIST file id ID #REQUIRED>
<!ATTLIST file path CDATA #REQUIRED>
<!ELEMENT result EMPTY>
<!ATTLIST result date CDATA #REQUIRED>
<!ATTLIST result statvalue CDATA #REQUIRED>
<!ATTLIST result type CDATA #REQUIRED>
<!ELEMENT summaryresult EMPTY>
<!ATTLIST summaryresult date CDATA #REQUIRED>
<!ATTLIST summaryresult statvalue CDATA #REQUIRED>
<!ATTLIST summaryresult filecount CDATA #REQUIRED>
<!ATTLIST summaryresult type CDATA #REQUIRED>
]>
<qalab version="1.1">
    <summary>
        <summaryresult date="2006-10-05" filecount="31" statvalue="1696" type="checkstyle"/>
        <summaryresult date="2006-10-05" filecount="2" statvalue="4" type="pmd"/>
        <summaryresult date="2006-10-05" filecount="7" statvalue="20" type="findbugs"/>
        <summaryresult date="2006-10-05" filecount="3" statvalue="170" type="simian"/>
        <summaryresult date="2006-10-06" filecount="18" statvalue="469" type="checkstyle"/>
        <summaryresult date="2006-10-06" filecount="2" statvalue="4" type="pmd"/>
        <summaryresult date="2006-10-06" filecount="7" statvalue="20" type="findbugs"/>
        <summaryresult date="2006-10-06" filecount="3" statvalue="170" type="simian"/>
        <summaryresult date="2006-10-12" filecount="31" statvalue="1696" type="checkstyle"/>
        <summaryresult date="2006-10-12" filecount="2" statvalue="4" type="pmd"/>
        <summaryresult date="2006-10-12" filecount="7" statvalue="20" type="findbugs"/>
        <summaryresult date="2006-10-12" filecount="3" statvalue="170" type="simian"/>
        <summaryresult date="2006-10-13" filecount="31" statvalue="1696" type="checkstyle"/>
        <summaryresult date="2006-10-13" filecount="2" statvalue="4" type="pmd"/>
        <summaryresult date="2006-10-13" filecount="7" statvalue="20" type="findbugs"/>
        <summaryresult date="2006-10-13" filecount="3" statvalue="170" type="simian"/>
        <summaryresult date="2006-10-14" filecount="31" statvalue="1696" type="checkstyle"/>
        <summaryresult date="2006-10-14" filecount="2" statvalue="4" type="pmd"/>
        <summaryresult date="2006-10-14" filecount="7" statvalue="20" type="findbugs"/>
        <summaryresult date="2006-10-14" filecount="3" statvalue="170" type="simian"/>
        <summaryresult date="2006-10-15" filecount="31" statvalue="1696" type="checkstyle"/>
        <summaryresult date="2006-10-15" filecount="2" statvalue="4" type="pmd"/>
        <summaryresult date="2006-10-15" filecount="7" statvalue="20" type="findbugs"/>
        <summaryresult date="2006-10-15" filecount="3" statvalue="170" type="simian"/>
        <summaryresult date="2006-10-16" filecount="18" statvalue="32" type="checkstyle"/>
        <summaryresult date="2006-10-16" filecount="2" statvalue="4" type="pmd"/>
        <summaryresult date="2006-10-16" filecount="7" statvalue="16" type="findbugs"/>
        <summaryresult date="2006-10-16" filecount="3" statvalue="116" type="simian"/>
        <summaryresult date="2006-10-16" filecount="13" statvalue="17" type="cobertura-line"/>
        <summaryresult date="2006-10-16" filecount="13" statvalue="23" type="cobertura-branch"/>
        <summaryresult date="2006-10-17" filecount="18" statvalue="25" type="checkstyle"/>
        <summaryresult date="2006-10-17" filecount="3" statvalue="5" type="pmd"/>
        <summaryresult date="2006-10-17" filecount="6" statvalue="11" type="findbugs"/>
        <summaryresult date="2006-10-17" filecount="3" statvalue="116" type="simian"/>
        <summaryresult date="2006-10-17" filecount="13" statvalue="17" type="cobertura-line"/>
        <summaryresult date="2006-10-17" filecount="13" statvalue="23" type="cobertura-branch"/>
        <summaryresult date="2006-10-18" filecount="19" statvalue="26" type="checkstyle"/>
        <summaryresult date="2006-10-18" filecount="3" statvalue="5" type="pmd"/>
        <summaryresult date="2006-10-18" filecount="6" statvalue="11" type="findbugs"/>
        <summaryresult date="2006-10-18" filecount="3" statvalue="116" type="simian"/>
        <summaryresult date="2006-10-18" filecount="14" statvalue="18" type="cobertura-line"/>
        <summaryresult date="2006-10-18" filecount="14" statvalue="24" type="cobertura-branch"/>
        <summaryresult date="2006-10-20" filecount="19" statvalue="26" type="checkstyle"/>
        <summaryresult date="2006-10-20" filecount="3" statvalue="5" type="pmd"/>
        <summaryresult date="2006-10-20" filecount="6" statvalue="11" type="findbugs"/>
        <summaryresult date="2006-10-20" filecount="3" statvalue="116" type="simian"/>
        <summaryresult date="2006-10-20" filecount="14" statvalue="18" type="cobertura-line"/>
        <summaryresult date="2006-10-20" filecount="14" statvalue="24" type="cobertura-branch"/>
        <summaryresult date="2006-10-25" filecount="19" statvalue="26" type="checkstyle"/>
        <summaryresult date="2006-10-25" filecount="3" statvalue="6" type="pmd"/>
        <summaryresult date="2006-10-25" filecount="6" statvalue="12" type="findbugs"/>
        <summaryresult date="2006-10-25" filecount="3" statvalue="106" type="simian"/>
        <summaryresult date="2006-10-25" filecount="14" statvalue="20" type="cobertura-line"/>
        <summaryresult date="2006-10-25" filecount="14" statvalue="27" type="cobertura-branch"/>
    </summary>
    <file id="com_pz_reader_ordering_package.html" path="com/pz/reader/ordering/package.html">
        <result date="2006-10-05" statvalue="1" type="checkstyle"/>
        <result date="2006-10-06" statvalue="1" type="checkstyle"/>
        <result date="2006-10-12" statvalue="1" type="checkstyle"/>
        <result date="2006-10-13" statvalue="1" type="checkstyle"/>
        <result date="2006-10-14" statvalue="1" type="checkstyle"/>
        <result date="2006-10-15" statvalue="1" type="checkstyle"/>
        <result date="2006-10-16" statvalue="1" type="checkstyle"/>
    </file>
    <file id="com_pz_reader_package.html" path="com/pz/reader/package.html">
        <result date="2006-10-05" statvalue="1" type="checkstyle"/>
        <result date="2006-10-06" statvalue="1" type="checkstyle"/>
        <result date="2006-10-12" statvalue="1" type="checkstyle"/>
        <result date="2006-10-13" statvalue="1" type="checkstyle"/>
        <result date="2006-10-14" statvalue="1" type="checkstyle"/>
        <result date="2006-10-15" statvalue="1" type="checkstyle"/>
        <result date="2006-10-16" statvalue="1" type="checkstyle"/>
    </file>
    <file id="com_pz_reader_util_package.html" path="com/pz/reader/util/package.html">
        <result date="2006-10-05" statvalue="1" type="checkstyle"/>
        <result date="2006-10-06" statvalue="1" type="checkstyle"/>
        <result date="2006-10-12" statvalue="1" type="checkstyle"/>
        <result date="2006-10-13" statvalue="1" type="checkstyle"/>
        <result date="2006-10-14" statvalue="1" type="checkstyle"/>
        <result date="2006-10-15" statvalue="1" type="checkstyle"/>
        <result date="2006-10-16" statvalue="1" type="checkstyle"/>
    </file>
    <file id="com_pz_reader_xml_package.html" path="com/pz/reader/xml/package.html">
        <result date="2006-10-05" statvalue="1" type="checkstyle"/>
        <result date="2006-10-06" statvalue="1" type="checkstyle"/>
        <result date="2006-10-12" statvalue="1" type="checkstyle"/>
        <result date="2006-10-13" statvalue="1" type="checkstyle"/>
        <result date="2006-10-14" statvalue="1" type="checkstyle"/>
        <result date="2006-10-15" statvalue="1" type="checkstyle"/>
        <result date="2006-10-16" statvalue="1" type="checkstyle"/>
    </file>
    <file id="com_pz_reader_structure_package.html" path="com/pz/reader/structure/package.html">
        <result date="2006-10-05" statvalue="1" type="checkstyle"/>
        <result date="2006-10-06" statvalue="1" type="checkstyle"/>
        <result date="2006-10-12" statvalue="1" type="checkstyle"/>
        <result date="2006-10-13" statvalue="1" type="checkstyle"/>
        <result date="2006-10-14" statvalue="1" type="checkstyle"/>
        <result date="2006-10-15" statvalue="1" type="checkstyle"/>
        <result date="2006-10-16" statvalue="1" type="checkstyle"/>
    </file>
    <file id="com_pz_reader_structure_Row.java" path="com/pz/reader/structure/Row.java">
        <result date="2006-10-05" statvalue="1" type="checkstyle"/>
        <result date="2006-10-05" statvalue="33" type="checkstyle"/>
        <result date="2006-10-05" statvalue="1" type="findbugs"/>
        <result date="2006-10-06" statvalue="1" type="checkstyle"/>
        <result date="2006-10-06" statvalue="33" type="checkstyle"/>
        <result date="2006-10-06" statvalue="1" type="checkstyle"/>
        <result date="2006-10-06" statvalue="33" type="checkstyle"/>
        <result date="2006-10-06" statvalue="1" type="checkstyle"/>
        <result date="2006-10-06" statvalue="33" type="checkstyle"/>
        <result date="2006-10-06" statvalue="1" type="checkstyle"/>
        <result date="2006-10-06" statvalue="33" type="checkstyle"/>
        <result date="2006-10-06" statvalue="1" type="checkstyle"/>
        <result date="2006-10-06" statvalue="33" type="checkstyle"/>
        <result date="2006-10-06" statvalue="2" type="checkstyle"/>
        <result date="2006-10-06" statvalue="1" type="findbugs"/>
        <result date="2006-10-12" statvalue="33" type="checkstyle"/>
        <result date="2006-10-12" statvalue="1" type="checkstyle"/>
        <result date="2006-10-12" statvalue="33" type="checkstyle"/>
        <result date="2006-10-12" statvalue="1" type="checkstyle"/>
        <result date="2006-10-12" statvalue="33" type="checkstyle"/>
        <result date="2006-10-12" statvalue="1" type="findbugs"/>
        <result date="2006-10-13" statvalue="1" type="checkstyle"/>
        <result date="2006-10-13" statvalue="33" type="checkstyle"/>
        <result date="2006-10-13" statvalue="1" type="checkstyle"/>
        <result date="2006-10-13" statvalue="33" type="checkstyle"/>
        <result date="2006-10-13" statvalue="1" type="findbugs"/>
        <result date="2006-10-14" statvalue="33" type="checkstyle"/>
        <result date="2006-10-14" statvalue="1" type="checkstyle"/>
        <result date="2006-10-14" statvalue="33" type="checkstyle"/>
        <result date="2006-10-14" statvalue="1" type="checkstyle"/>
        <result date="2006-10-14" statvalue="33" type="checkstyle"/>
        <result date="2006-10-14" statvalue="1" type="findbugs"/>
        <result date="2006-10-15" statvalue="33" type="checkstyle"/>
        <result date="2006-10-15" statvalue="1" type="checkstyle"/>
        <result date="2006-10-15" statvalue="33" type="checkstyle"/>
        <result date="2006-10-15" statvalue="1" type="checkstyle"/>
        <result date="2006-10-15" statvalue="33" type="checkstyle"/>
        <result date="2006-10-15" statvalue="1" type="checkstyle"/>
        <result date="2006-10-15" statvalue="33" type="checkstyle"/>
        <result date="2006-10-15" statvalue="1" type="findbugs"/>
        <result date="2006-10-16" statvalue="1" type="findbugs"/>
        <result date="2006-10-16" statvalue="44" type="cobertura-line"/>
    </file>
    <file id="com_pz_reader_DataError.java" path="com/pz/reader/DataError.java">
        <result date="2006-10-05" statvalue="22" type="checkstyle"/>
        <result date="2006-10-06" statvalue="5" type="checkstyle"/>
        <result date="2006-10-12" statvalue="22" type="checkstyle"/>
        <result date="2006-10-13" statvalue="22" type="checkstyle"/>
        <result date="2006-10-14" statvalue="22" type="checkstyle"/>
        <result date="2006-10-15" statvalue="22" type="checkstyle"/>
        <result date="2006-10-16" statvalue="3" type="checkstyle"/>
        <result date="2006-10-16" statvalue="100" type="cobertura-branch"/>
    </file>
    <file id="com_pz_reader_DataSet.java" path="com/pz/reader/DataSet.java">
        <result date="2006-10-05" statvalue="485" type="checkstyle"/>
        <result date="2006-10-05" statvalue="5" type="findbugs"/>
        <result date="2006-10-06" statvalue="103" type="checkstyle"/>
        <result date="2006-10-06" statvalue="5" type="findbugs"/>
        <result date="2006-10-12" statvalue="485" type="checkstyle"/>
        <result date="2006-10-12" statvalue="5" type="findbugs"/>
        <result date="2006-10-13" statvalue="485" type="checkstyle"/>
        <result date="2006-10-13" statvalue="5" type="findbugs"/>
        <result date="2006-10-14" statvalue="485" type="checkstyle"/>
        <result date="2006-10-14" statvalue="5" type="findbugs"/>
        <result date="2006-10-15" statvalue="485" type="checkstyle"/>
        <result date="2006-10-15" statvalue="5" type="findbugs"/>
        <result date="2006-10-16" statvalue="9" type="checkstyle"/>
        <result date="2006-10-16" statvalue="3" type="findbugs"/>
        <result date="2006-10-16" statvalue="20" type="cobertura-line"/>
        <result date="2006-10-16" statvalue="25" type="cobertura-branch"/>
    </file>
    <file id="com_pz_reader_LargeDataSet.java" path="com/pz/reader/LargeDataSet.java">
        <result date="2006-10-05" statvalue="278" type="checkstyle"/>
        <result date="2006-10-05" statvalue="3" type="findbugs"/>
        <result date="2006-10-06" statvalue="63" type="checkstyle"/>
        <result date="2006-10-06" statvalue="3" type="findbugs"/>
        <result date="2006-10-12" statvalue="278" type="checkstyle"/>
        <result date="2006-10-12" statvalue="3" type="findbugs"/>
        <result date="2006-10-13" statvalue="278" type="checkstyle"/>
        <result date="2006-10-13" statvalue="3" type="findbugs"/>
        <result date="2006-10-14" statvalue="278" type="checkstyle"/>
        <result date="2006-10-14" statvalue="3" type="findbugs"/>
        <result date="2006-10-15" statvalue="278" type="checkstyle"/>
        <result date="2006-10-15" statvalue="3" type="findbugs"/>
        <result date="2006-10-16" statvalue="5" type="checkstyle"/>
        <result date="2006-10-16" statvalue="1" type="findbugs"/>
    </file>
    <file id="com_pz_reader_Version.java" path="com/pz/reader/Version.java">
        <result date="2006-10-05" statvalue="2" type="checkstyle"/>
        <result date="2006-10-12" statvalue="2" type="checkstyle"/>
        <result date="2006-10-13" statvalue="2" type="checkstyle"/>
        <result date="2006-10-14" statvalue="2" type="checkstyle"/>
        <result date="2006-10-15" statvalue="2" type="checkstyle"/>
        <result date="2006-10-16" statvalue="100" type="cobertura-branch"/>
    </file>
    <file id="com_pz_reader_ordering_OrderBy.java" path="com/pz/reader/ordering/OrderBy.java">
        <result date="2006-10-05" statvalue="65" type="checkstyle"/>
        <result date="2006-10-05" statvalue="5" type="findbugs"/>
        <result date="2006-10-06" statvalue="12" type="checkstyle"/>
        <result date="2006-10-06" statvalue="5" type="findbugs"/>
        <result date="2006-10-12" statvalue="65" type="checkstyle"/>
        <result date="2006-10-12" statvalue="5" type="findbugs"/>
        <result date="2006-10-13" statvalue="65" type="checkstyle"/>
        <result date="2006-10-13" statvalue="5" type="findbugs"/>
        <result date="2006-10-14" statvalue="65" type="checkstyle"/>
        <result date="2006-10-14" statvalue="5" type="findbugs"/>
        <result date="2006-10-15" statvalue="65" type="checkstyle"/>
        <result date="2006-10-15" statvalue="5" type="findbugs"/>
        <result date="2006-10-16" statvalue="5" type="findbugs"/>
    </file>
    <file id="com_pz_reader_ordering_OrderColumn.java" path="com/pz/reader/ordering/OrderColumn.java">
        <result date="2006-10-05" statvalue="25" type="checkstyle"/>
        <result date="2006-10-06" statvalue="4" type="checkstyle"/>
        <result date="2006-10-12" statvalue="25" type="checkstyle"/>
        <result date="2006-10-13" statvalue="25" type="checkstyle"/>
        <result date="2006-10-14" statvalue="25" type="checkstyle"/>
        <result date="2006-10-15" statvalue="25" type="checkstyle"/>
    </file>
    <file id="com_pz_reader_structure_ColumnMetaData.java" path="com/pz/reader/structure/ColumnMetaData.java">
        <result date="2006-10-05" statvalue="99" type="checkstyle"/>
        <result date="2006-10-06" statvalue="66" type="checkstyle"/>
        <result date="2006-10-12" statvalue="99" type="checkstyle"/>
        <result date="2006-10-13" statvalue="99" type="checkstyle"/>
        <result date="2006-10-14" statvalue="99" type="checkstyle"/>
        <result date="2006-10-15" statvalue="99" type="checkstyle"/>
        <result date="2006-10-16" statvalue="50" type="cobertura-line"/>
        <result date="2006-10-16" statvalue="100" type="cobertura-branch"/>
    </file>
    <file id="com_pz_reader_structure_Row.java" path="com/pz/reader/structure/Row.java"/>
    <file id="com_pz_reader_util_ExcelTransformer.java" path="com/pz/reader/util/ExcelTransformer.java">
        <result date="2006-10-05" statvalue="60" type="checkstyle"/>
        <result date="2006-10-06" statvalue="8" type="checkstyle"/>
        <result date="2006-10-12" statvalue="60" type="checkstyle"/>
        <result date="2006-10-13" statvalue="60" type="checkstyle"/>
        <result date="2006-10-14" statvalue="60" type="checkstyle"/>
        <result date="2006-10-15" statvalue="60" type="checkstyle"/>
    </file>
    <file id="com_pz_reader_util_ParserUtils.java" path="com/pz/reader/util/ParserUtils.java">
        <result date="2006-10-05" statvalue="290" type="checkstyle"/>
        <result date="2006-10-05" statvalue="3" type="pmd"/>
        <result date="2006-10-05" statvalue="3" type="findbugs"/>
        <result date="2006-10-06" statvalue="25" type="checkstyle"/>
        <result date="2006-10-06" statvalue="3" type="pmd"/>
        <result date="2006-10-06" statvalue="3" type="findbugs"/>
        <result date="2006-10-12" statvalue="290" type="checkstyle"/>
        <result date="2006-10-12" statvalue="3" type="pmd"/>
        <result date="2006-10-12" statvalue="3" type="findbugs"/>
        <result date="2006-10-13" statvalue="290" type="checkstyle"/>
        <result date="2006-10-13" statvalue="3" type="pmd"/>
        <result date="2006-10-13" statvalue="3" type="findbugs"/>
        <result date="2006-10-14" statvalue="290" type="checkstyle"/>
        <result date="2006-10-14" statvalue="3" type="pmd"/>
        <result date="2006-10-14" statvalue="3" type="findbugs"/>
        <result date="2006-10-15" statvalue="290" type="checkstyle"/>
        <result date="2006-10-15" statvalue="3" type="pmd"/>
        <result date="2006-10-15" statvalue="3" type="findbugs"/>
        <result date="2006-10-16" statvalue="5" type="checkstyle"/>
        <result date="2006-10-16" statvalue="3" type="pmd"/>
        <result date="2006-10-16" statvalue="3" type="findbugs"/>
        <result date="2006-10-16" statvalue="35" type="cobertura-line"/>
        <result date="2006-10-16" statvalue="42" type="cobertura-branch"/>
    </file>
    <file id="com_pz_reader_xml_PZMapParser.java" path="com/pz/reader/xml/PZMapParser.java">
        <result date="2006-10-05" statvalue="257" type="checkstyle"/>
        <result date="2006-10-05" statvalue="1" type="pmd"/>
        <result date="2006-10-05" statvalue="1" type="findbugs"/>
        <result date="2006-10-06" statvalue="158" type="checkstyle"/>
        <result date="2006-10-06" statvalue="1" type="pmd"/>
        <result date="2006-10-06" statvalue="1" type="findbugs"/>
        <result date="2006-10-12" statvalue="257" type="checkstyle"/>
        <result date="2006-10-12" statvalue="1" type="pmd"/>
        <result date="2006-10-12" statvalue="1" type="findbugs"/>
        <result date="2006-10-13" statvalue="257" type="checkstyle"/>
        <result date="2006-10-13" statvalue="1" type="pmd"/>
        <result date="2006-10-13" statvalue="1" type="findbugs"/>
        <result date="2006-10-14" statvalue="257" type="checkstyle"/>
        <result date="2006-10-14" statvalue="1" type="pmd"/>
        <result date="2006-10-14" statvalue="1" type="findbugs"/>
        <result date="2006-10-15" statvalue="257" type="checkstyle"/>
        <result date="2006-10-15" statvalue="1" type="pmd"/>
        <result date="2006-10-15" statvalue="1" type="findbugs"/>
        <result date="2006-10-16" statvalue="5" type="checkstyle"/>
        <result date="2006-10-16" statvalue="1" type="pmd"/>
        <result date="2006-10-16" statvalue="1" type="findbugs"/>
    </file>
    <file id="com_pz_reader_xml_ResolveLocalDTD.java" path="com/pz/reader/xml/ResolveLocalDTD.java">
        <result date="2006-10-05" statvalue="40" type="checkstyle"/>
        <result date="2006-10-05" statvalue="2" type="findbugs"/>
        <result date="2006-10-06" statvalue="16" type="checkstyle"/>
        <result date="2006-10-06" statvalue="2" type="findbugs"/>
        <result date="2006-10-12" statvalue="40" type="checkstyle"/>
        <result date="2006-10-12" statvalue="2" type="findbugs"/>
        <result date="2006-10-13" statvalue="40" type="checkstyle"/>
        <result date="2006-10-13" statvalue="2" type="findbugs"/>
        <result date="2006-10-14" statvalue="40" type="checkstyle"/>
        <result date="2006-10-14" statvalue="2" type="findbugs"/>
        <result date="2006-10-15" statvalue="40" type="checkstyle"/>
        <result date="2006-10-15" statvalue="2" type="findbugs"/>
        <result date="2006-10-16" statvalue="2" type="findbugs"/>
    </file>
    <file id="com_pz_reader_xml_XMLRecordElement.java" path="com/pz/reader/xml/XMLRecordElement.java">
        <result date="2006-10-05" statvalue="34" type="checkstyle"/>
        <result date="2006-10-06" statvalue="2" type="checkstyle"/>
        <result date="2006-10-12" statvalue="34" type="checkstyle"/>
        <result date="2006-10-13" statvalue="34" type="checkstyle"/>
        <result date="2006-10-14" statvalue="34" type="checkstyle"/>
        <result date="2006-10-15" statvalue="34" type="checkstyle"/>
        <result date="2006-10-16" statvalue="100" type="cobertura-branch"/>
    </file>
    <file
        id="C:_project_pzfilereader_PZFileReader_src_test_java_com_test_delim_multiLine_TestCSVPerformance.java" path="C:/project/pzfilereader/PZFileReader/src/test/java/com/test/delim/multiLine/TestCSVPerformance.java"/>
    <file id="net_sf_pzfilereader_util_package.html" path="net/sf/pzfilereader/util/package.html">
        <result date="2006-10-17" statvalue="1" type="checkstyle"/>
    </file>
    <file id="net_sf_pzfilereader_package.html" path="net/sf/pzfilereader/package.html">
        <result date="2006-10-17" statvalue="1" type="checkstyle"/>
    </file>
    <file id="net_sf_pzfilereader_ordering_package.html" path="net/sf/pzfilereader/ordering/package.html">
        <result date="2006-10-17" statvalue="1" type="checkstyle"/>
    </file>
    <file id="net_sf_pzfilereader_xml_package.html" path="net/sf/pzfilereader/xml/package.html">
        <result date="2006-10-17" statvalue="1" type="checkstyle"/>
    </file>
    <file id="net_sf_pzfilereader_structure_package.html" path="net/sf/pzfilereader/structure/package.html">
        <result date="2006-10-17" statvalue="1" type="checkstyle"/>
    </file>
    <file id="net_sf_pzfilereader_DataError.java" path="net/sf/pzfilereader/DataError.java">
        <result date="2006-10-17" statvalue="3" type="checkstyle"/>
        <result date="2006-10-17" statvalue="100" type="cobertura-branch"/>
        <result date="2006-10-18" statvalue="3" type="checkstyle"/>
        <result date="2006-10-18" statvalue="100" type="cobertura-branch"/>
        <result date="2006-10-20" statvalue="3" type="checkstyle"/>
        <result date="2006-10-20" statvalue="100" type="cobertura-branch"/>
        <result date="2006-10-25" statvalue="3" type="checkstyle"/>
        <result date="2006-10-25" statvalue="100" type="cobertura-branch"/>
    </file>
    <file id="net_sf_pzfilereader_DataSet.java" path="net/sf/pzfilereader/DataSet.java">
        <result date="2006-10-17" statvalue="4" type="checkstyle"/>
        <result date="2006-10-17" statvalue="1" type="pmd"/>
        <result date="2006-10-17" statvalue="2" type="findbugs"/>
        <result date="2006-10-17" statvalue="21" type="cobertura-line"/>
        <result date="2006-10-17" statvalue="27" type="cobertura-branch"/>
        <result date="2006-10-18" statvalue="5" type="checkstyle"/>
        <result date="2006-10-18" statvalue="1" type="pmd"/>
        <result date="2006-10-18" statvalue="2" type="findbugs"/>
        <result date="2006-10-18" statvalue="21" type="cobertura-line"/>
        <result date="2006-10-18" statvalue="27" type="cobertura-branch"/>
        <result date="2006-10-20" statvalue="5" type="checkstyle"/>
        <result date="2006-10-20" statvalue="1" type="pmd"/>
        <result date="2006-10-20" statvalue="2" type="findbugs"/>
        <result date="2006-10-20" statvalue="21" type="cobertura-line"/>
        <result date="2006-10-20" statvalue="27" type="cobertura-branch"/>
        <result date="2006-10-25" statvalue="5" type="checkstyle"/>
        <result date="2006-10-25" statvalue="1" type="pmd"/>
        <result date="2006-10-25" statvalue="2" type="findbugs"/>
        <result date="2006-10-25" statvalue="21" type="cobertura-line"/>
        <result date="2006-10-25" statvalue="27" type="cobertura-branch"/>
    </file>
    <file id="net_sf_pzfilereader_LargeDataSet.java" path="net/sf/pzfilereader/LargeDataSet.java">
        <result date="2006-10-17" statvalue="4" type="checkstyle"/>
        <result date="2006-10-18" statvalue="4" type="checkstyle"/>
        <result date="2006-10-20" statvalue="4" type="checkstyle"/>
        <result date="2006-10-25" statvalue="4" type="checkstyle"/>
    </file>
    <file id="net_sf_pzfilereader_ordering_OrderBy.java" path="net/sf/pzfilereader/ordering/OrderBy.java">
        <result date="2006-10-17" statvalue="1" type="checkstyle"/>
        <result date="2006-10-17" statvalue="2" type="findbugs"/>
        <result date="2006-10-18" statvalue="1" type="checkstyle"/>
        <result date="2006-10-18" statvalue="2" type="findbugs"/>
        <result date="2006-10-20" statvalue="1" type="checkstyle"/>
        <result date="2006-10-20" statvalue="2" type="findbugs"/>
        <result date="2006-10-25" statvalue="1" type="checkstyle"/>
        <result date="2006-10-25" statvalue="2" type="findbugs"/>
    </file>
    <file id="net_sf_pzfilereader_util_ParserUtils.java" path="net/sf/pzfilereader/util/ParserUtils.java">
        <result date="2006-10-17" statvalue="4" type="checkstyle"/>
        <result date="2006-10-17" statvalue="3" type="pmd"/>
        <result date="2006-10-17" statvalue="3" type="findbugs"/>
        <result date="2006-10-17" statvalue="33" type="cobertura-line"/>
        <result date="2006-10-17" statvalue="41" type="cobertura-branch"/>
        <result date="2006-10-18" statvalue="9" type="checkstyle"/>
        <result date="2006-10-18" statvalue="3" type="pmd"/>
        <result date="2006-10-18" statvalue="3" type="findbugs"/>
        <result date="2006-10-18" statvalue="36" type="cobertura-line"/>
        <result date="2006-10-18" statvalue="43" type="cobertura-branch"/>
        <result date="2006-10-20" statvalue="9" type="checkstyle"/>
        <result date="2006-10-20" statvalue="3" type="pmd"/>
        <result date="2006-10-20" statvalue="3" type="findbugs"/>
        <result date="2006-10-20" statvalue="36" type="cobertura-line"/>
        <result date="2006-10-20" statvalue="43" type="cobertura-branch"/>
        <result date="2006-10-25" statvalue="9" type="checkstyle"/>
        <result date="2006-10-25" statvalue="4" type="pmd"/>
        <result date="2006-10-25" statvalue="4" type="findbugs"/>
        <result date="2006-10-25" statvalue="43" type="cobertura-line"/>
        <result date="2006-10-25" statvalue="52" type="cobertura-branch"/>
    </file>
    <file id="net_sf_pzfilereader_xml_PZMapParser.java" path="net/sf/pzfilereader/xml/PZMapParser.java">
        <result date="2006-10-17" statvalue="4" type="checkstyle"/>
        <result date="2006-10-17" statvalue="1" type="pmd"/>
        <result date="2006-10-17" statvalue="1" type="findbugs"/>
        <result date="2006-10-18" statvalue="4" type="checkstyle"/>
        <result date="2006-10-18" statvalue="1" type="pmd"/>
        <result date="2006-10-18" statvalue="1" type="findbugs"/>
        <result date="2006-10-20" statvalue="4" type="checkstyle"/>
        <result date="2006-10-20" statvalue="1" type="pmd"/>
        <result date="2006-10-20" statvalue="1" type="findbugs"/>
        <result date="2006-10-25" statvalue="4" type="checkstyle"/>
        <result date="2006-10-25" statvalue="1" type="pmd"/>
        <result date="2006-10-25" statvalue="1" type="findbugs"/>
    </file>
    <file id="net_sf_pzfilereader_xml_ResolveLocalDTD.java" path="net/sf/pzfilereader/xml/ResolveLocalDTD.java">
        <result date="2006-10-17" statvalue="2" type="findbugs"/>
        <result date="2006-10-18" statvalue="2" type="findbugs"/>
        <result date="2006-10-20" statvalue="2" type="findbugs"/>
        <result date="2006-10-25" statvalue="2" type="findbugs"/>
    </file>
    <file id="net_sf_pzfilereader_structure_Row.java" path="net/sf/pzfilereader/structure/Row.java">
        <result date="2006-10-17" statvalue="1" type="findbugs"/>
        <result date="2006-10-17" statvalue="44" type="cobertura-line"/>
        <result date="2006-10-18" statvalue="1" type="findbugs"/>
        <result date="2006-10-18" statvalue="44" type="cobertura-line"/>
        <result date="2006-10-20" statvalue="1" type="findbugs"/>
        <result date="2006-10-20" statvalue="44" type="cobertura-line"/>
        <result date="2006-10-25" statvalue="1" type="findbugs"/>